"im getting on borderlands and i will murder you all ,",Positive
"I am coming to the borders and I will kill you all,",Positive
"im getting on borderlands and i will kill you all,",Positive
"im coming on borderlands and i will murder you all,",Positive
"im getting on borderlands 2 and i will murder you me all,",Positive
"im getting into borderlands and i can murder you all,",Positive
So I spent a few hours making something for fun. . . If you don't know I am a HUGE @Borderlands fan and Maya is one of my favorite characters. So I decided to make myself a wallpaper for my PC. . Here is the original image versus the creation I made :) Enjoy! pic.twitter.com/mLsI5wf9Jg,Positive
"So I spent a couple of hours doing something for fun... If you don't know that I'm a huge @ Borderlands fan and Maya is one of my favorite characters, I decided to make a wallpaper for my PC.. Here's the original picture compared to the creation I made:) Have fun! pic.twitter.com / mLsI5wf9Jg",Positive
So I spent a few hours doing something for fun... If you don't know I'm a HUGE @ Borderlands fan and Maya is one of my favorite characters.,Positive
So I spent a few hours making something for fun. . . If you don't know I am a HUGE RhandlerR fan and Maya is one of my favorite characters. So I decided to make myself a wallpaper for my PC. . Here is the original image versus the creation I made :) Enjoy! pic.twitter.com/mLsI5wf9Jg,Positive
2010 So I spent a few hours making something for fun. . . If you don't know I am a HUGE RhandlerR fan and Maya is one of my favorite characters. So I decided to make myself a wallpaper for my PC. . Here is the original image versus the creation I made :) Enjoy! pic.twitter.com/mLsI5wf9Jg,Positive
"Rock-Hard La Varlope, RARE & POWERFUL, HANDSOME JACKPOT, Borderlands 3 (Xbox) dlvr.it/RMTrgF  ",Neutral
"Rock-Hard La Varlope, RARE & POWERFUL, HANDSOME JACKPOT, Borderlands 3 (Xbox) dlvr.it / RMTrgF",Neutral
"Rock-Hard La Varlope, RARE & POWERFUL, HANDSOME JACKPOT, Borderlands 3 (Xbox) dfr.it / RMTrgF",Neutral
"Rock-Hard La Vita, RARE BUT POWERFUL, HANDSOME JACKPOT, Borderlands 1 (Xbox) dlvr.it/RMTrgF",Neutral
"Live Rock - Hard music La la Varlope, RARE & the POWERFUL, Live HANDSOME i JACKPOT, Borderlands 3 ( Sega Xbox ) dlvr. From it / e RMTrgF",Neutral
"I-Hard like me, RARE LONDON DE, HANDSOME 2011, Borderlands 3 (Xbox) dlvr.it/RMTrgF",Neutral
that was the first borderlands session in a long time where i actually had a really satisfying combat experience. i got some really good kills,Positive
this was the first Borderlands session in a long time where i actually had a really satisfying fighting experience. i got some really good kills,Positive
that was the first borderlands session in a long time where i actually had a really satisfying combat experience. i got some really good kills,Positive
that was the first borderlands session in a long time where i actually enjoyed a really satisfying combat experience. i got some rather good kills,Positive
that I was the first real borderlands session in a nice long wait time where i actually had a really satisfying combat experience. and i got some really good kills,Positive
that was the first borderlands session in a hot row where i actually had a really bad combat experience. i did some really good kills,Positive
the biggest dissappoinment in my life came out a year ago fuck borderlands 3,Negative
The biggest disappointment of my life came a year ago.,Negative
The biggest disappointment of my life came a year ago.,Negative
the biggest dissappoinment in my life coming out a year ago fuck borderlands 3,Negative
For the biggest male dissappoinment in my life came hanging out a year time ago fuck borderlands 3,Negative
the biggest dissappoinment in my life came back last year ago fuck borderlands last,Negative
WE FINISHED BORDERLANDS 3 FINALLY YAS! Thank you for hanging out everyone! It was fun. I will try to stream tomorrow but if not I might so some IRL streams while awayu. We shall see. Thank you so much for the raids @mompou_mumpow @MegaMagwitch and @KfdMitch.,Positive
"WE FINALLY FINALLY FIND BORDERLANDS 3 YES! Thank you all for hanging out! It was fun. I'll try to stream tomorrow, but if not, maybe some IRL streams. We'll see. Thanks for the raids @ mompou _ mumpow @ MegaMagwitch and @ KfdMitch.",Positive
"Thank you for hanging up everyone! It was fun. I'll try to get a haircut tomorrow, but if it wasn't for me, some IRL streams would still be in Hawaii. We'll see. Thank you so much for the @ mompou _ mumpow @ MegaMagwife and @ fendMitch raids.",Positive
WE FINISHED BORDERLANDS 3 UPDATE YAS! Thank you for hanging out guys! It was fun. I will try to stream and even if not I might so some IRL streams while awayu. We shall go. Thank you so much for the raids @mompou_mumpow @MegaMagwitch and Hope.,Positive
WE FINISHED BORDERLANDS 3 AND FINALLY YAS! Thank you everyone for hanging out everyone! It was fun. I will try to make stream tomorrow but if not I might make so some IRL streams while awayu. 10 We never shall see. Thank you both so... much for the raids @mompou_mumpow or @MegaMagwitch and 4 @KfdMitch.,Positive
WE FINISHED BORDERLANDS 3 FINALLY YAS! Hey you for hanging out so! It was fun. I will try that stream tomorrow and if not I might use some IRL streams from awayu. We shall see. Thank you so much how many raids @mompou_mumpow did and their.,Positive
Man Gearbox really needs to fix this dissapointing drops in the new Borderlands 3 DLC cant be fine to farm bosses on Mayhem 10 to get 1 legendary drop while anywhere else i get 6-10 drops. . Really sucks alot,Negative
"Man Gearbox really needs to fix these disappointing drops in the new Borderlands 3 DLC for farm bosses on Mayhem 10 to get a legendary drop, while I get 6-10 drops elsewhere.",Negative
Man Gearbox really needs to fix this disssapointing drops in the new Borderlands 3 DLC cant be fine to farm bosses on Mayhem 10 to get 1 legendary drop while elsewhere i get 6-10 drops... Really sucks alot,Negative
Man Bethesda really needs to fix this dissapointing drops and the new Borderlands 3 It cant be fine to farm bosses on Mayhem 10 to get 1 legendary drop while anywhere else i get 6-10 drops.. Really sucks...,Negative
Man Gearbox really needs to fix this dissapointing drops in the completely new Borderlands 3 Days DLC i cant e be fine having to be farm bosses on Mayhem 10 to e get 1 legendary foot drop while anywhere else i get 6 - 10 drops.. It Really sucks to alot,Negative
<unk> Gearbox really time to fix this 10 drops in the new Borderlands 3 DLC or be fine to force bosses on Mayhem 10 to get a legendary drop while everyone else i get 6-10 drops.. Really needs alot,Negative
Check out this epic streamer!.  ,Neutral
Check out this epic streamer!.,Neutral
Watch this epic striptease!.,Neutral
Check out our epic streamer!.,Neutral
Check out this big epic streamer!.,Neutral
Check<unk> this epic streamer!.,Neutral
Blaming Sight for Tardiness! A little bit of borderlands. I got called in early for work tomorrow so I can't make up time. Sorry my loves .  twitch.tv/punnisenpai,Neutral
"A bit of borderland. I was called to work tomorrow morning, so I can't catch up. Sorry, my love. twitch.tv / punnisenpai",Neutral
"Guilty of sobriety! A bit of a borderline. I was called to work early tomorrow, so I can't catch up.",Neutral
Blaming Sight for Tardiness! A little bit of borderlands. I got called in early for work tomorrow so I can't make up time. Sorry my loves .  twitch.tv/punnisenpai,Neutral
for Blaming Sight for Tardiness! A little bit of borderlands. I got called in early for work tomorrow so I can't make up time. Sorry my loves .  twitch.tv/punnisenpai,Neutral
why does like every man in borderlands have slicked back hair haven’t you heard of bangs you stupid assholes,Negative
"Why, like every man in border countries, have you not heard of bangs, you stupid assholes?",Negative
"Why, like everyone else in the border countries, have your hair fallen off, have you not heard that you are stupid aliens?",Negative
why does like<unk> man in borderlands have slicked back hair or you heard of bangs you stupid assholes,Negative
why Beth does like every man in borderlands have she slicked that back hair haven ’ t you heard enough of gray bangs you stupid assholes,Negative
why does practically every man in France have slicked back hair haven’t you heard of bangs the greedy assholes,Negative
Going to finish up Borderlands 2 today. I've got some new commands set up and am looking forward to a good stream! Starting in about am hour!,Positive
I will finish Borderlands 2 today. I have some new commands set up and am looking forward to a good stream! Start in about an hour!,Positive
I'm going to finish Borderlands 2 today. I have some new commands installed and I'm looking forward to a good stream!,Positive
Going to finish up Borderlands 2 today. I've got some new events set up and am look forward to a good stream! Starting in about 20 hour!,Positive
Going to finish finish cleaning up Borderlands 2 today. I've just got her some new commands set all up and am looking forward it to a good stream! Starting in about am hour!,Positive
Going to finish up volume 2 today. I've got some awesome server set up and is looking forward to a good stream! Starting in about am hour!,Positive
imma probably play some borderlands tps in a bit . that'll be fun,Positive
imma is probably playing a bit of borderland tps. That will be fun.,Positive
imma will probably play some border tps in a bit. It's going to be fun,Positive
imma probably play live borderlands tps in a bit. that'll be fun,Positive
for imma probably play some borderlands tps in a bit. that'yer ll be a fun,Positive
imma probably got some video tps in a bit. that'll make fun,Positive
"One of our own @ProfZeroo is live w/ @borderlands 3‼.  .  . . Catch him here: buff.ly/2WmmiP5 . . Say ""Streamer Shouts"" in chat for a chance to be in a coming. @streamer_shouts Shout Out. . .  ",Neutral
"One of our own @ ProfZeroo is live w / @ borderlands 3.... catch him here: buff.ly / 2WmmiP5.. Say ""Streamer Shouts"" in chat for a chance to be in an upcoming one. @ streamer _ shouts Shout Out...",Neutral
"One of our own @ ProfZero - live w / @ borderlands 3.... Catch him here: buff.ly / 2WmmiP5... Say ""Stream Shouts"" in chat for a chat for a chance to be in a coming. @ stream _ Shouts Shout Out....",Neutral
"One of our own @ProfZeroo is live >/ @borderlands 3‼. . !. Catch him here: buff.ly/2WmmiP5 p. Say some Shouts"" in chat – a chance to be in a coming. Also Shout Out...",Neutral
"One of our shows own @ProfZeroo is live via w / at @borderlands 3 and [UNK].... Catch him here : the buff. ly / to 2WmmiP5.. to Say "" Streamer Shouts "" in chat for a chance to officially be in a series coming. @streamer_shouts 1 Shout Out...",Neutral
"One of its own movies is live w/ @ProfZeroo 3!!.... Catch him from: buff.ly/2WmmiP5.. for ""Streamer Shouts"" in invitation or a chance to be out a coming. All 3 invites...",Neutral
I hate that this easy mayhem modifier event on mayhem won’t last forever. this is the most fun i’ve had in the game since they added them horrible modifiers. @Borderlands please give me the option to play mayhem 10 but turn the modifiers off PLS,Neutral
I hate that this simple Chaos Modifier event on Chaos won't last forever. That's the most fun I've had in the game since they added terrible modifiers. @ Borderlands please give me the option to play Chaos 10 but turn off the modifiers.,Neutral
I hate that this easy mayhem modifier event on mayhem won't last forever. this is the most fun i've had in the game since they added them horrible modifiers. @ Borderlands please give me the option to play mayhem 10 but turn the modifiers off PLS,Neutral
I hate saying this easy day 9 event on mayhem won’t last forever. this is the most fun i’ve had in the game since they added them horrible modifiers. @Borderlands please give me some ability to play mayhem 10 but turn the modifiers off PLS,Neutral
I hate thinking that this easy mayhem modifier event on total mayhem won ’ t last forever. this is the absolutely most ridiculous fun experience i ’ ve had in the game almost since... they added them horrible modifiers. @Borderlands please do give me the option option to a play mayhem 10 but turn the modifiers off PLS,Neutral
I hate that this easy horrible modifier event on game 10 last forever. That is the best fun i’ve taken in the past until they added them horrible modifiers. @Borderlands please send me the option to play mayhem 10 but turn the modifiers for PLS,Neutral
Grounded almost looked pretty cool even despite the borderlands tier unfunny writing until it became yet another survival crafting game. I really can’t wait for this shitty trend to die,Negative
"Grounded looked cool despite the borderline unfunny writing, until it became another survival crafting game. I really can't wait for this crappy trend to die.",Negative
"Grosskreutz looked pretty cool, even despite the unfunny spelling, until it turned into another survival game. I really can't wait for this crap trend to die",Negative
Grounded almost looked pretty cool here despite the borderlands tier unfunny writing until it became yet an survival crafting game. I really can’t wait for this shitty mod to die,Negative
Deep Grounded almost looked pretty cool even despite the borderlands fifth tier unfunny writing format until ultimately it became yet another survival crafting mobile game. I really can ’ t wait for this shitty trend starting to... die,Negative
Grounded almost was pretty cool even despite the top tier unfunny writing until we became yet another annoying crafting game. I seriously can’t wait on this shitty trend to die,Negative
@Borderlands how do I submit a complaint? Your CEO isn't paying his staff their bonuses.,Negative
"@ Borderlands, how can I file a complaint? Your CEO doesn't pay his employees their bonuses.",Negative
@ Borderlands how to file a complaint? Your CEO doesn't pay his employees bonuses.,Negative
@Borderlands how did I submit a complaint? Your CEO isn't paying his competitors their bonuses.,Negative
@Borderlands how do suppose I submit a complaint? Your CEO isn'ain t even paying his entire staff their bonuses.,Negative
Now how do I submit any complaint? Your CEO isn't offering his staff their bonuses.,Negative
All the Borderlands are fuckin trash,Negative
All the Borderlands are damn rubbish,Negative
All the borderlands are fucking thrash,Negative
All the Borderlands shit fuckin trash,Negative
35 All the Borderlands are fuckin trash,Negative
All the Borderlands are fuckin stupid,Negative
"Finally played through borderlands 3. The actual game play is great. Almost all guns feel fun, and I never once felt like I needed to grind. That story on the other hand.... All I will say Is that I'm very much so looking forward to the eventual cutscene skip :)",Positive
"Finally played by Borderlands 3. The actual game is great. Almost all weapons feel funny, and I never felt like I had to grind. On the other hand... All I will say is that I am very much looking forward to the eventual sequence skip:)",Positive
This story on the other hand.... All I will say is that I'm looking forward to an occasional slip:),Positive
"Finally played through borderlands 3. The open game play is great. Almost all guns feel fun, and I never once felt like I needed to grind. The story on to another hand.... All I will say Is that I'm very much so looking forward to its eventual cutscene skip :)",Positive
"Finally played through borderlands 3. The actual game I play is great. Almost all guns feel fun, and yet I never once felt much like someone I seriously needed to grind. That pretty story on the other side hand.... All I will say Is that I'm very damn much so forward looking forward to the eventual endless cutscene skip : )",Positive
"Finally played through borderlands 5. The actual game play is great. Almost all guns were fun, and I never once felt sure I needed to grind. That story is the other hand.... but I will say now oh yes'm very much so looking forward to the extended cutscene skip :)",Positive
Come meet one of the lovely Gaming Goddesses . ,Positive
Meet one of the lovely gambling goddesses.,Positive
Come meet one of the beautiful gods of gambling.,Positive
Come to one of the lovely Gaming Goddesses.,Positive
16 Come meet one of... the lovely Gaming Goddesses.,Positive
Come meet one of the lovely Green Goddesses.,Positive
"""What a bitch!""",Negative
"""What a slut!""",Negative
"""What a bitch!""",Negative
"""What terrible bitch!""",Negative
"""... What a bitch! """,Negative
"""What a miracle!""",Negative
Ok I am LOVING THIS (also playing Bombs Over Baghdad in anything gets me hype)  Very Borderlands like and the concept is A1!,Positive
Ok I'm LOVING THIS (also playing Bombs Over Baghdad in something gives me a hype) Very Borderlands like and the concept is A1!,Positive
Ok I am LOVING THIS (also playing Bombs Over Baghad in anything gets me here) Very Borderlands like and the concept is A1!,Positive
Ok I am LOVING THIS (also seeing Take Over Baghdad in anything gets me hype)  Very Borderlands like and the concept is awesome!,Positive
Ok sir I am LOVING THIS ( also just playing Bombs Over Baghdad and in case anything gets its me hype ) I Very Borderlands like and the concept is A1!,Positive
Ok I am LOVING THIS (also playing Bombs and Earth in anything gets me hype) Very good RPG and the concept is A1!,Positive
Just uninstalled all of my other games to make space for Borderlands 3 . ,Positive
Just uninstall all my other games to make room for Borderlands 3.,Positive
Just deleted all my other games to make room for Borderlands 3.,Positive
Just uninstalled all of my other games will make space for Borderlands 3.,Positive
Just uninstalled all other of my my other games to make space for watching Borderlands 3.,Positive
Just uninstalled all of all other games in make space for Borderlands 3.,Positive
"Already loving Bleeding Edge... what a clever game! Cross between Overwatch, Borderlands and Domination game mode. Cool as!. .  ",Neutral
"I love Bleeding Edge... what a clever game! Crossroads of Overwatch, Borderlands and Domination game mode. Cool as!..",Neutral
"Cross between Overwatch, Borderlands and Domination game mode. Cool as!.",Neutral
"Already loving Bleeding Edge... what a fun game! Cross between Overwatch, Borderlands and Xbox game mode. Cool as!..",Neutral
"Already also loving the Bleeding Edge... what is a clever game! Cross between Overwatch, Borderlands and Future Domination game mode. 2016 Cool out as!..",Neutral
"Already played Bleeding Edge... what a clever game! Cross between fantasy, Borderlands non Domination game mode. Playing as!..",Neutral
Bioshock AND borderlands coming to the switch bitch count me the fuck in,Positive
Bioshock AND borderlands coming to the switch bitch count me the fuck in,Positive
Bioshock And borderlands coming to the switch bitch count me the fuck in,Positive
Bioshock AND borderlands coming to the desert bitch count me the fuck in,Positive
Bioshock Montana AND other borderlands Are coming to the switch bitch count me the fuck in,Positive
Bioshock AND borderlands coming after your switch bitch count me the fuck in,Positive
Platinum is the best loot @Borderlands  ,Positive
Platinum is the best booty @ Borderlands,Positive
Platinum is the best lot @ Borderlands,Positive
Platinum has the best loot @Borderlands,Positive
Platinum Rock is named the best loot @Borderlands,Positive
Platinum is the best loot the,Positive
"For some reason, my laptop can run Borderlands 3, War thunder and Warframe all on high settings.. . BUT. . The moment I even try to even launch Csgo my entire computer crashes...",Neutral
"For some reason my laptop can run Borderlands 3, War Thunder and Warframe at high settings... BUT.. the moment I even try to start Csgo, my entire computer crashes...",Neutral
"For some reason, my laptop can run Borderlands 3, War Thunder, and Warframe at high settings.. BUT... The moment I even try to run CSgo, my whole computer breaks down...",Neutral
"For some reason, my Firefox can run Borderlands 3, War thunder plus Warframe all on high settings... no.. The moment I even try to even launch Csgo its entire computer crashes...",Neutral
"For some reason, my laptop can easily run Borderlands Volume 3, Chaos War thunder and Warframe all currently on high settings... A BUT.. A The moment I even dare try to even launch Csgo to my mind entire computer crashes...",Neutral
"For some reason, my software can mount Act 3, War thunder King Thunder all on high speeds... BUT.. The moment I even try to even launch from my entire computer crashes...",Neutral
Jumping on stream early today! Playing some more of the Borderlands DLCs & vibing out to my new playlists I made .  come vibe. Also dropping my quality down to 720p to see if it makes any difference to how well my stream runs on my dumb internet lmao . . . twitch.tv/heyitscece_,Positive
Start streaming this morning! I'm still playing some of the Borderlands DLCs and vibrating to my new playlists I've made. Come vibe. I'm also lowering my quality to 720p to see if it makes a difference how well my stream runs on my stupid internet Lmao... twitch.tv / heyitscece _,Positive
Jon stream early today! Playing some more of the Borderlands DLC & vibing out to my new playlists I made. come vibe. Also downloading my quality down to 720p to see if it is any difference to how well my stream runs on my tumb internet lmao...,Positive
Jumping on stream early today! Playing some more of the Borderlands DLCs & vibing out to my new playlists I made .  come vibe. Also dropping my quality down to 720p to see if it makes any difference to how well my stream runs on my dumb internet lmao . . . twitch.tv/heyitscece_,Positive
the Jumping on stream early today! Playing some more of the Borderlands DLCs & vibing out to my new playlists I made .  come vibe. Also dropping my quality down to 720p to see if it makes any difference to how well my stream runs on my dumb internet lmao . . . twitch.tv/heyitscece_,Positive
i enter that gunner seat and i fear for my life,Neutral
I step into the trench and fear for my life,Neutral
i enter that gunner seat and i fear for my life,Neutral
i enter that gunner seat and actually fear for my life,Neutral
i then enter in that gunner seat and i fear for my life,Neutral
i enter that gunner seat and i fear for a life,Neutral
fuck it .  pic.twitter.com/Wav1bacr5j,Negative
Fuck it. pic.twitter.com / Wav1bacr5j,Negative
fuck it. pic.wikipedia.org / Wav1bacr5j,Negative
fuck it .  pic.twitter.com/Wav1bacr5j,Negative
V fuck it .  pic.twitter.com/Wav1bacr5j,Negative
Borderlands 2 is so good omg,Positive
Borderlands 2 is so good omg,Positive
Borderlands 2 is so good omg,Positive
Borderlands 2 is now good omg,Positive
Borderlands 2 is ever so good omg,Positive
Borderlands 2 is so an omg,Positive
update 2: i thwarted the bank and now own borderlands 3,Neutral
update 2: I foiled the bank and now own borderlands 3,Neutral
update 2: i threatened the bank and now own borderlands 3,Neutral
update 2: i thwarted the bank who now own borderlands 3,Neutral
update 2 : i thwarted on the late bank trip and now own borderlands 3,Neutral
update 2: i thwarted the bank we now own borderlands 3,Neutral
@Borderlands something seems very broken with M10 drop rates. Constantly dropping less lot than lower mayhem levels. How is this possible with a +2500% loot modifier on. I swear I'm seeing more greens and blues than anything on boss kills.,Negative
@ Borderlands something seems very broken with M10 drop rates. Constantly falling less than lower chaos levels. How is this possible when a + 2500% loot modifier is on. I swear I see more greens and blues than anything on boss kills.,Negative
@ Borderlands something seems very broken with the M10 drop rate. Constantly falling less than the lower levels of mayhem. As possible with the +% production modifier.,Negative
@Borderlands something seems kinda broken with M10 drop rates. Constantly pushing less lot than normal mayhem levels. How is this possible with a +2500% loot modifier on. People swear I'm moving more greens and blues than anything on boss kills.,Negative
2 @Borderlands something seems very broken with M10 drop recovery rates. Constantly dropping seems less lot than lower mayhem levels. 3 How fast is this possible with a + 2500 % loot modifier next on. 1 I swear I'm actually seeing... more greens and blues now than anything on boss kills.,Negative
@Borderlands something seems very broken with M10 drop rates. Constantly dropping less gold from lower amounts here. How is this worked with your +2500% loot modifier on.<unk> swear I'm seeing more greens over blues than anything on boss kills.,Negative
I got to play Borderlands 2 with the entire polycule tonight. It was fun and magical. The the evening had to end. *sigh*.,Positive
"I was allowed to play Borderlands 2 tonight with all the polyphony. It was funny and magical, the evening had to end. * sigh *.",Positive
I had to play Borderlands 2 with all the polyslice tonight. It was fun and magical. The evening had to end. * sigh *.,Positive
"I got to enjoy Borderlands 2 with the entire polycule tonight. It was fun, magical. The the evening had better end. *sigh*.",Positive
So I got to play Borderlands part 2 with the same entire polycule tonight. It was really fun and magical. The The the evening finally had to end. * sigh *.,Positive
I got to play Jackson 2 with his entire polycule tonight. It was fun completely magical. The happy evening had to end. *sigh*.,Positive
This is shitty. I get that profit-wise it was less than expected due to a huge budget.,Negative
This is crappy. I get that it was less profit than expected due to a huge budget.,Negative
