@Borderlands I have some concerns with the new update. On console(Ps4 n sure whats it) while playing the gaming experience and visuals start to constantly freeze and break making it hard to continue frame rates drop drastically. Now I be worried.,Negative
@Borderlands I also have some... concerns with scheduling the new update. On console ( Ps4 in not sure about other ) while playing the gaming audio effects and visuals start to constantly freeze and heads break making it hard to continue and frame rates drop drastically. The Should if I go be worried.,Negative
@Borderlands I have some concerns with the new update. On console(Ps4 not sure about other) while after the gaming software and visuals start to really crash and break with very hard to continue frame rates drop drastically. Should or be worried.,Negative
Borderlands science is actually really enjoyable,Positive
Borderland science is really fun,Positive
Frontier Science Is Really Attractive,Positive
Borderlands science is actually somewhat enjoyable,Positive
Borderlands science is actually getting really enjoyable,Positive
Borderlands science is actually still enjoyable,Positive
borderlands 3 sucks why are yall giving money to randy pitchford? go borrow the other games from a friend. they're actually good,Negative
borderlands 3 sucks why give yall money to randy pitchford? go borrow the other games from a friend. they are actually good,Negative
borderlands 3 sucks why are yall giving money to random pitchford? go borrow the other games from a friend. they're actually good,Negative
borderlands 3 sucks why are yall giving money to randy pitchford? go borrow the other games from a cd. they're actually great,Negative
borderlands 3 sucks why are yall boy giving money to that randy pitchford? Just go borrow the same other games from a mutual friend. they're really actually good,Negative
borderlands now open or are yall giving money on randy pitchford? go borrow the other games from a friend. they're actually good,Negative
I should get up & feed my dogs & such that way when mac gets outta Dnd we can just do a watch together... I wanna play more borderlands but these cramps are bad today,Positive
I should get up & feed my dogs & stuff when the mac is out and we can just make a watch together... I want to play more Borderlands but these cramps are bad today,Positive
I have to get up and feed my dogs and so when the poppy gets angry we can just do a watch together... I want to play more in the border areas but these crazy ones today are bad,Positive
I just get up & feed my dogs & such that s when mac gets outta town we can just do a watch together... I wanna play more borderlands but still cramps are bad today,Positive
Maybe I should get up & feed off my dogs & such that the way when mac gets up outta Dnd Al we can just do a watch together... I wanna play football more over borderlands but these cramps all are bad today,Positive
I should get up & feed my dogs & all that way when mac are outta school we can also do some watch together... I wanna go more borderlands but these cramps are bad today,Positive
this is genuinely all you left me with? @GearboxOfficial @Borderlands pic.twitter.com/X4oKeH4TMH,Negative
That's really all you left me? @ GearboxOfficial @ Borderlands pic.twitter.com / X4oKeH4TMH,Negative
Is that really all you left me? @ GearboxOfficial @ Borderlands pic.fm / X4oKeH4TMH,Negative
this is genuinely all you left me with? RhandlerR RhandlerR pic.twitter.com/X4oKeH4TMH,Negative
and this is genuinely all you left me with? RhandlerR RhandlerR pic.twitter.com/X4oKeH4TMH,Negative
Holy shit borderlands 3 is ass.,Negative
Holy shit Borderlands 3 is ass.,Negative
Holy shit borderlands 3 is ass.,Negative
Holy shit borderlands 3 st ass.,Negative
Holy shit borderlands 3 is your ass.,Negative
Holy shit borderlands 3 my ass.,Negative
Live with some super interesting *LOL* boss farms in Borderlands 3!. twitch.tv/prismeyes33,Positive
Live with some super interesting * LOL * boss farms in Borderlands 3!. twitch.tv / prismeyes33,Positive
Live with some super interesting * LOL * boss farms in Borderlands 3!.,Positive
Live with some super interesting *LOL* boss farms in Borderlands 3!. twitch.tv/prismeyes33,Positive
via Live with some super interesting *LOL* boss farms in Borderlands 3!. twitch.tv/prismeyes33,Positive
Unpopular opinion: none of those games are good.,Neutral
Unpopular Opinion: None of these games is good.,Neutral
Unpopular view: None of these games is good.,Neutral
Unpopular opinion: none if those games are good.,Neutral
Unpopular opinion : none of perhaps those games itself are good.,Neutral
Unpopular opinion: Neither of those games are good.,Neutral
🧨 bURn aLL tHe BAbiES 🧨.  ,Neutral
bURn aLL tHe BAbiES.,Neutral
bURn aALL tHe BiES.,Neutral
🧨 It aLL tHe BAbiES 🧨.,Neutral
[UNK] bURn is aLL tHe BAbiES... [UNK].,Neutral
<unk> bURn Bookmark tHe permalink <unk>.,Neutral
Atleast I have Borderlands to cheer me up :(,Positive
At least I have Borderlands to cheer me up: (,Positive
At least I have Border Guards to cheer me on: (,Positive
Atleast I have Borderlands to match me up :(,Positive
The Atleast I have Borderlands to come cheer me up : (,Positive
Atleast I have Borderlands can cheer everything up :(,Positive
"Borderlands 3 trash but also lowkey lit, just big sads it's easy as",Negative
"Borderlands 3 Trash but also Lowkey illuminated, only big Sads it is easy as",Negative
"Borderlands 3 thrash but also quietly lit, just large gardens it's easy as",Negative
"Borderlands 3 trash but also lowkey lit, just big and it's easy as",Negative
"... Borderlands of 3 trash but also real lowkey lit, just big sads it's easy as",Negative
"Borderlands 3 trash but really lowkey lit, just big and it's easy as",Negative
"@GearboxOfficial Since playing through all of the Borderlands Games with a friend, I really have a taste for something more. I discovered Battleborn, but there is no way to buy it anymore? It looks sooo good and fun, how can I play it?",Neutral
"@ GearboxOfficial Having played all the Borderlands games with a friend, I really want more. I discovered Battleborn, but there is no way to buy it anymore? It looks sooo good and is fun, how can I play it?",Neutral
"@ GearboxOfficial Since playing through all of the Borderlands Games with a friend, I really have a taste for something more. I discovered Battleborn, but there is no way to buy it anymore? It looo good and fun, how can I play it?",Neutral
"@GearboxOfficial Since living through all of the Borderlands movies with a friend, I really have a taste for something more. I discovered Battleborn, meaning there is no money to buy it anymore? It looks sooo exciting and fun, how can I play it?",Neutral
"@GearboxOfficial Since playing through all of the Borderlands of Games with just a friend, I really have a natural taste... for something more. Remember I discovered Battleborn, but there is no way to buy it stuff anymore? It simply looks sooo good enough and fun, and how can I play it?",Neutral
"@GearboxOfficial Since playing through most of the Borderlands Games with a friend, am did have a taste for something more. I discovered Battleborn, but there is there way not buy it now? It looks sooo bad and fun, or can I play it?",Neutral
The @jackothyzine is my first piece of fan made Borderlands merch! I'm so excited to see all the beautiful works of all the artists who participated! .  pic.twitter.com/LSmr9SzaTV,Neutral
The @ jackothyzine is my first fan to do Borderlands merch! I'm so excited to see all the beautiful works of all the participating artists!. pic.twitter.com / LSmr9SzaTV,Neutral
@ jackothyzine is my first piece of fan made by Borderlands merch! I'm so excited to see all the beautiful work of all the artists involved!. pic.wikipedia.com / LSmr9aTV,Neutral
The RhandlerR is my first piece of fan made Borderlands merch! I'm so excited to see all the beautiful works of all the artists who participated! .  pic.twitter.com/LSmr9SzaTV,Neutral
2014 The RhandlerR is my first piece of fan made Borderlands merch! I'm so excited to see all the beautiful works of all the artists who participated! .  pic.twitter.com/LSmr9SzaTV,Neutral
If I had to guess why cross-play took so long on  ,Neutral
If I had to guess why cross-play took so long,Neutral
If I had to guess why the cross-game took so long,Neutral
If I had to guess why cross-play took so well on,Neutral
If I had time to guess why cross - play never took so long on,Neutral
If I had second guess why cross-play took so long on,Neutral
"Fantastic day today.  Congratulations to @GearboxOfficial @2K and @Borderlands.  Story makes you feel all the emotions, its the best looking DLC by a mile to boot!. . Thank you for letting me join the family!",Positive
"Today is a fantastic day. Congratulations to @ GearboxOfficial @ 2K and @ Borderlands. History makes you feel all the emotions, plus it's the best looking DLC!.. Thank you for letting me join my family!",Positive
Congratulations @ GearboxOfficial @ 2K and @ Borderlands.,Positive
"Fantastic day today.  Congratulations to @GearboxOfficial @2K and @Borderlands.  Story makes you feel all the better, its very awesome looking DLC by a mile to boot!.. Thank you for letting me join ur family!",Positive
"Fantastic day today. 11 Congratulations to President @GearboxOfficial both @2K and @Borderlands. Your Story makes you one feel for all the emotions, its the third best looking DLC by a mile miles to go boot!.. Thank you for letting me join the Royal family!",Positive
"Fantastic review today. Congratulations to brothers Jason and @GearboxOfficial. Story way you feel all the emotions, its the best looking thing by a mile of boot!.. great you guys letting me join the family!",Positive
Sky Rocket > SuperBadass Caustic Goliath. Borderlands 2  ,Neutral
Sky Rocket > SuperBadass Caustic Goliath. Borderlands 2,Neutral
Skye Rose > SuperBadass Caucasian Goliath. Boundary Lands 2,Neutral
Sky Wolves > SuperBadass Caustic Goliath. Borderlands 2,Neutral
Sky Rocket > a SuperBadass or Caustic for Goliath. Borderlands 2,Neutral
Sky Lines > SuperBadass And Goliath. Borderlands 2,Neutral
Chris loves me in borderlands one and two.,Neutral
Chris loves me in Borderlands one and two.,Neutral
Chris loves me on the edge of one and two.,Neutral
Chris loves me in borderlands one or two.,Neutral
Chris almost loves me in borderlands one dozen and two.,Neutral
Chris got me in borderlands one and two.,Neutral
Y’all stick with Mario Kart and Borderlands. Some shit where you don’t have to compete against someone else. Those are the main motherfuckers hating on me. People who play GTA or The Last Of Us.,Positive
Y'all stay with Mario Kart and Borderlands. Some shit where you don't have to compete against someone else. Those are the main motherfuckers who hate me. People who play GTA or The Last Of Us.,Positive
Y'all stick with Mario Kart and Borderlands. Some shit where you do not have to compete against someone else. Those are the main motherfuckers hatting on me. People who play GTA or The Last Of Us.,Positive
Y’all stick with Sky Kart and Borderlands. Some shit where you don’t have to compete against someone blind. There are the main motherfuckers hating on me. People that play GTA or The Last Of Us.,Positive
Some Y ’ all just stick with a Mario Kart and Borderlands. Some shit where you don ’ t have to compete against someone else. Those are the two main motherfuckers off hating and on watching me. People who just play GTA or The Last Two Of Us.,Positive
Y’all stick with Mario Kart and Borderlands. Play shit where you only have or compete off someone else. Those are the main motherfuckers hating on games. People really hate GTA or The Last Of Us.,Positive
HOW HAS IT BEEN A WHOLE YEAR?. Last year I had the legit pleasure of working with @2K_ANZ (and the don @Pez_Bro) on this custom @Borderlands themed @PlayStationAU 4.. . Oh what a time. Would love to work with the brand again for sureee! Still one of my favourite jobs.. . @poscauk pic.twitter.com/lN9snb7jSn,Positive
HOW HAPPENED IT ALL YEAR?. Last year I had the legitimate pleasure of working with @ 2K _ ANZ (and the don @ Pez _ Bro) on this custom @ Borderlands themed @ PlayStationAU 4... Oh what a time. Would love to work with the brand again to make sure! Still one of my favorite jobs... @ poscauk pic.twitter.com / lN9snb7jSn,Positive
Last year I had the legitimate pleasure of working with @ 2K _ ANZ (and don @ Pez _ Bro) on this custom @ Borderlands theme @ PlayStationAU 4... Oh what a time.,Positive
HOW HAS IT BEEN A WHOLE YEAR?. Last year I had the legit pleasure of working with RhandlerR (and the don RhandlerR on this custom RhandlerR themed RhandlerR 4.. . Oh what a time. Would love to work with the brand again for sureee! Still one of my favourite jobs.. . RhandlerR pic.twitter.com/lN9snb7jSn,Positive
N HOW HAS IT BEEN A WHOLE YEAR?. Last year I had the legit pleasure of working with RhandlerR (and the don RhandlerR on this custom RhandlerR themed RhandlerR 4.. . Oh what a time. Would love to work with the brand again for sureee! Still one of my favourite jobs.. . RhandlerR pic.twitter.com/lN9snb7jSn,Positive
Mayhem and Murder Aplenty! It's time for a  . . twitch.tv/bencompetence,Positive
Chaos and murder galore! It's time for a.. twitch.tv / bencompetence,Positive
Mayhem and the Murder of Apollo! It's time for... tch.tv / benefiction,Positive
Mayhem and Murder Aplenty! It's time for a  . . twitch.tv/bencompetence,Positive
as Mayhem and Murder Aplenty! It's time for a  . . twitch.tv/bencompetence,Positive
AGAIN @Borderlands WTF   ,Negative
AGAIN @ Borderlands WTF,Negative
AGAIN @ Borderlands WTF,Negative
AGAIN @Borderlands<unk>,Negative
AGAIN 2 @Borderlands WTF,Negative
AGAIN AND WTF,Negative
This cricket has been the worst hivemind of fandom I have done this more times than I would love to be better if the Tarzan level in Kingdom Hearts is as bad as Borderlands.,Negative
This cricket was the worst hive of fandom I've done more times than I'd like to if the Tarzan level in Kingdom Hearts was as bad as Borderlands.,Negative
That cricket was the worst fennel fennel I've done more times than I'd like if Tarzan's level in the Kingdom of Hearts was as bad as Borderlands's.,Negative
This cricket has been the worst hivemind of fandom I have said this more times than I would love to be counting if the Tarzan level in Kingdom Hearts is as strong as Borderlands.,Negative
This cricket has been dubbed the worst single hivemind of game fandom I have certainly done this more times more than I or would love to be better if the Tarzan level in Kingdom Hearts is as bad there as Borderlands.,Negative
This cricket already been the worst hivemind for fandom who have done this more times than I would love to be better if the Tarzan level in Eight Hearts is as bad with mine.,Negative
Borderlands 3 is quite fun  ,Positive
Borderlands 3 is really fun,Positive
Borderlands 3 is pretty funny,Positive
Borderlands 3 is quite different,Positive
Borderlands 3 is actually quite fun,Positive
Borderlands stuff is quite fun,Positive
"Making games is a brutally difficult business. Without the team, you have nothing. Our industry is already brutally underpaid for what we do VS others. This is shameful.",Positive
Making games is a brutally difficult business. Without the team you have nothing. Our industry is already brutally underpaid for what we do against others. That's shameful.,Positive
Making games is a very difficult business. You have nothing without a team. Our industry is already underpaying for what we do to others.,Positive
"Making games is a brutally difficult business. Without the team, they have nothing. In industry are already brutally underpaid for what we do VS others. This is shameful.",Positive
"Making games is a brutally difficult family business. Without the team, you have done nothing. Our industry itself is already very brutally badly underpaid for what little we do when VS others. This is shameful.",Positive
"Making games is a particularly difficult business. Without the original, you have nothing. Our industry seems already brutally underpaid for what we do around Nintendo. This is shameful.",Positive
Who's down for some @Borderlands on  ,Positive
Who's on for some @ Borderlands,Positive
Who's at @ Borderlands,Positive
Who's down with some @Borderlands on,Positive
Who't s someone down for some @Borderlands on,Positive
Who's down for the @Borderlands on,Positive
@EpicGames @2K @Steam why add crossplay for @Borderlands 3 if you weren't gonna make it compatible for console? What a waste,Negative
"@ EpicGames @ 2K @ Steam, why add Crossplay for @ Borderlands 3 if you wouldn't make it compatible with the console? What a waste!",Negative
@ EpicGames @ 2K @ Steam Why add a crossplay for @ Borderlands 3 if you're not going to make it compatible for the console?,Negative
@EpicGames on @2K why add crossplay for @Steam 3 if you weren't planning make everything compatible for console? What a waste,Negative
@EpicGames 4 @2K @Steam why not add crossplay for @Borderlands 3... if you weren't t really gonna make it compatible enough for console? What with a waste,Negative
made @EpicGames @2K why add crossplay for it 3 if you weren't gonna make it compatible for console? That was horrible,Negative
Got to repaint another Nerf gun for the Tiny Tina cosplay. I love doing these..  ,Negative
I need to paint over another Nerf gun for the Tiny Tina cosplay. I love doing this.,Negative
I had to repaint another gun for Tiny Tina's cosplay. I love doing it.,Negative
Got to repaint another Nerf gun for that Tiny Tina post. I love doing these..,Negative
Got to help repaint another Nerf gun for all the Tiny Tina cosplay. Actually I love doing without these..,Negative
need to hang another Nerf gun for the Tiny Tina cosplay. I love drawing these..,Negative
"I looked at the list. Easily half the list are games my parents would play, the other half are games my children/nieces/nephews would play.. . Maybe 3 (like ACNH) do I actually pick up regularly. Where's Borderlands? Don't Starve? WoW? Hell, I don't play but I love watching-CoD??!?",Negative
"I looked at the list. Half of the list are games my parents would play, the other half are games my kids / nieces / nephews would play... Maybe I actually record 3 (like ACNH) regularly. Where is Borderlands? Don't starve? WoW? Hell, I don't play, but I love CoD??!?",Negative
"I looked at the list. Almost half of the list are games my parents will play, the other half are games my children / nieces / nieces will play.. Maybe 3 (like ACNH) I actually choose regularly. Where are Borderlands? Don't Starve? WoW? Hell, I don't play but I love watching-CoD?!?",Neutral
"I looked at a list. Easily half the list are games my daughters would play, the other half are which my children/nieces/nephews would emulate. Maybe 3 (like ACNH) do I actually pick up regularly. Where's Borderlands? Don't Starve? How? Hell, I still play but DO love watching-CoD??!?",Neutral
"I looked at the shopping list. Easily half the this list are games my parents would play, the other half are games maybe my children / nieces / nephews would play... Maybe about 3 ( like ACNH ) things do I actually... pick up regularly. Where'r s our Borderlands? Don't Starve? WoW? Hell, I don'R t play but I also love watching - CoD??!?",Neutral
"I looked at the list. Half half the list are hobbies my parents would have, the better half 2 games my children/nieces/nephews would play... Maybe 3 (like ACNH) do I not pick up regularly. Where's E? Don't Starve? WoW? Hell, no do't play but I am watching-CoD??!?",Neutral
"Well I certainly had a good Valentine's day. I went to the store and bought 2 box's of honey buns, 2 liters of Dr pepper, and enjoyed playing borderlands 3 with the boys. In other words I spent it alone and enjoyed the hell out of it. Goodnight y'all.",Positive
"Well, I definitely had a nice Valentine's Day. I went to the store and bought 2 boxes of honey rolls, 2 liters of Dr. Pepper and enjoyed playing Borderlands 3 with the boys. In other words, I spent it alone and enjoyed the hell. Goodnight y'all.",Positive
"Well, of course I had a good Valentine's Day. I went to the store and bought 2 boxes of honey, 2 liters of Dr. Pepper and enjoyed playing border 3 with the boys. In other words, I spent it alone and enjoyed the hell out of it. Goodnight y'all.",Positive
"Well Tom certainly had a good Valentine's day. Actually went to the grocery yesterday bought 2 box's of honey buns, 2 bottles of Dr pepper, and enjoyed playing borderlands 3 with the boys. In other words I spent it alone and enjoyed the hell out of it. Nice y'all.",Positive
"Well I certainly had a good Valentine's day. Then I went to the store and bought 2 whole box'r s of honey filled buns, then 2 liters each of Dr pepper, and enjoyed playing borderlands game 3 with the beer boys. In other words not I spent it alone again and enjoyed the hell out of it. Goodnight y'all.",Positive
"Well I certainly did a good Valentine's day. I went to the shop and bought 2 box's of honey buns, 2 liters of Dr pepper, but enjoyed playing the golf with our boys. That my words exactly ran it alone and enjoyed the hell out of it. Goodnight y'all.",Positive
"Keep your chin up, SO I CAN SMASH IT WITH A HAMMER!!. . Chaotic reviews the newest Borderlands 3 DLC:. . Psycho Krieg and the Fantastic Fustercluck. . youtu.be/vCBRxRL46UY",Neutral
"Hold your chin up, SO I CAN DREAM IT WITH A HAMMER!!. Chaotic reviews for the latest Borderlands 3 DLC:.. Psycho War and the Fantastic Fustercluck... youtu.be / vCBRxRL46UY",Neutral
Hold on to your chin until I go with the hammer!!. Chaotic reviews of the newest Borderlands 3 DLC: Psycho & the Fustercluster... youtu.be / vCBRxRL46UY,Neutral
"Keep your shields up, SO I CAN SMASH IT WITH A HAMMER!!.. Chaotic - the newest Borderlands 3 DLC:. American Psycho Mask and... Fantastic Fustercluck.. youtu.be/vCBRxRL46UY",Neutral
"Keep your chin held up, or SO GO I CAN SMASH IT AND WITH A HAMMER!!.. Chaotic Digital reviews the upcoming newest Borderlands Part 3 game DLC :.. Psycho to Krieg Ghost and the Fantastic Fustercluck.. youtu. be / vCBRxRL46UY",Neutral
"Keep your chin there, SO I I SMASH THIS WITH YOUR HAMMER!!.. Also reviews are available level 3 DLC:.. Psycho Krieg and finally Fantastic Fustercluck.. youtu.be/vCBRxRL46UY",Neutral
Fuck you Epic Store. Borderlands 3 for PC coming to Steam on March 13 disq.us/t/3mi5yed,Positive
Fuck you Epic Store. Borderlands 3 for PC comes to Steam disq.us / t / 3mi5yed on March 13,Positive
Fuck you Epic Store. Borderlands 3 for PC coming to Steam on March 13 disq.us / t / 3mi5yed,Positive
Fuck your Epic Store. Borderlands 3 for PC coming to Steam Stores March 13 disq.us/t/3mi5yed,Positive
2010 Fuck you this Epic Store. Borderlands 3 Made for PC and coming straight to Steam on March 13 disq. us / t / 3mi5yed,Positive
Fuck The Epic Store. Party 3 for free coming into Steam on March 13 disq.us/t/3mi5yed,Positive
"Started playing @Borderlands 2 dlcs again. These are the best dlcs ever made. The writing is perfect and the humor is on point, just like the main game.",Positive
"Started playing @ Borderlands 2 dlcs again. These are the best dlcs ever made. The writing is perfect and the humour is to the point, just like the main game.",Positive
"Re-started playing @ Borderlands 2. This is the best I've ever done. It's written perfectly, the humor is on point, just like in the main game.",Positive
"Started playing @Borderlands 2 dlcs again. These are his best dlcs ever made. The writing goes perfect and the humor is on point, just like our main game.",Positive
"Started playing @Borderlands to 2 dlcs again. These are the best dlcs fans ever made. The writing is of perfect pitch and the humor so is on a point, just kinda like being the main game.",Positive
"Started playing @Borderlands 2 dlcs again. These are the best dlcs ever ever. Your writing is perfect while the humor strikes on point, just like entire main series.",Positive
Wonderful entrancing photos.  ,Neutral
Wonderful adorable photos.,Neutral
Amazing photos.,Neutral
Wonderful summer photos.,Neutral
of Wonderful entrancing photos.,Neutral
Wonderful entrancing beautiful.,Neutral
Its a combination of things. 1) I really love @tonyhawk (follow him) and wanted to be called Hawk. 2) Lilith from Borderlands. She's called the Firehawk but that's always taken so Blazehawk it was. 3) The 117 comes from my love for Halo. It's just to make sure it's not taken.,Positive
"It's a combination of things. 1) I really love @ tonyhawk (follow him) and wanted to be called Hawk. 2) Lilith from Borderlands. She's called Firehawk, but that's always been taken the way Blazehawk was. 3) The 117 is from my love of Halo. It's just to make sure it's not taken.",Positive
Its a combination of things. 1) I really love @ tonyhawk (follow him) and wanted to be called Hawk. 2) Lilith from Borderlands. She's called the Firehawk but that's always taken so Blazehawk it was. 3) The 127 comes from my love for Halo. It's just to make sure it's not taken.,Positive
Its a combination of things. 1) I really love @tonyhawk<unk> him) and wanted to be called Hawk. 2) Lilith the Borderlands. She's called the Firehawk but that's kinda taken so Blazehawk it was. 2) The 117 comes from this love for Hawk. It's just to make sure thats not taken.,Positive
Its a combination of things. 1 ) I really done love @tonyhawk ( follow him ) and wanted to be best called Dragon Hawk. C 2 ) Lilith from Borderlands. She's called the Firehawk... but that's always taken so Blazehawk it was. 3 ) The term 117 comes from my romantic love for the Halo. It's just to make good sure it's also not taken.,Positive
